{
  "receipt_id": "rcpt_20260426_1001",
  "request_id": "req_20260426_0001",
  "decision": "PASS",
  "uap_score": 2.95,
  "proof_status": "BOUND",
  "anchor_hash": "94565A33A458C91A2C217C89491C1279D97D4244D310B7BB9B4F519D09702152",
  "timestamp": "2026-04-26T16:00:00Z",
  "digest": "sha256:example_receipt_hash"
}
